<?xml version="1.0" encoding="UTF-8"?>
<!DOCTYPE pedidos SYSTEM "ej5.dtd">
<pedidos>
    <pedido id ="p12">
        <cliente></cliente>
        <nombre></nombre>
        <direccion>
            <calle></calle>
            <ciudad></ciudad>
            <cp></cp>
        </direccion>
        <productos id="p4">
            <producto></producto>
            <precio></precio>
            <cantidad></cantidad>
        </productos>
    </pedido>
</pedidos>